{
  "artifact_kind": "run_report",
  "artifacts": {
    "evidence": "evidence/",
    "obligation_view": "obligation-view.json",
    "report": "report.json"
  },
  "axioms": {
    "O1": [],
    "O2": [],
    "O3": [],
    "O4": [],
    "O5": []
  },
  "blocking_reasons": [
    {
      "claims": [],
      "code": "VERIFIER_NOT_RUN",
      "message": "no frozen challenge; run `verislop formalize` first",
      "obligations": [],
      "severity": "blocking"
    },
    {
      "claims": [],
      "code": "VERIFIER_NOT_RUN",
      "message": "the implementation phase has not started (no frozen implementation claims)",
      "obligations": [],
      "severity": "blocking"
    },
    {
      "claims": [
        "CLOSURE:clean-builds"
      ],
      "code": "ORPHAN_CLAIM",
      "message": "required finalization claim CLOSURE:clean-builds is absent or invalid",
      "obligations": [],
      "severity": "blocking"
    },
    {
      "claims": [
        "CLOSURE:endpoint"
      ],
      "code": "ORPHAN_CLAIM",
      "message": "required finalization claim CLOSURE:endpoint is absent or invalid",
      "obligations": [],
      "severity": "blocking"
    },
    {
      "claims": [
        "CLOSURE:determinism"
      ],
      "code": "ORPHAN_CLAIM",
      "message": "required finalization claim CLOSURE:determinism is absent or invalid",
      "obligations": [],
      "severity": "blocking"
    },
    {
      "claims": [
        "CLOSURE:provenance"
      ],
      "code": "ORPHAN_CLAIM",
      "message": "required finalization claim CLOSURE:provenance is absent or invalid",
      "obligations": [],
      "severity": "blocking"
    },
    {
      "claims": [],
      "code": "REVIEW_NOT_RUN",
      "message": "review checkpoint formal_contract is configured as a release gate but has not run",
      "obligations": [],
      "severity": "blocking"
    },
    {
      "claims": [],
      "code": "REVIEW_NOT_RUN",
      "message": "review checkpoint release is configured as a release gate but has not run",
      "obligations": [],
      "severity": "blocking"
    }
  ],
  "bridge_preparations": [],
  "builds": [],
  "counts": {
    "milestones": {
      "END_TO_END_VERIFIED": {
        "NOT_APPLICABLE": 5,
        "PENDING": 5
      },
      "FORMALIZED": {
        "FAIL": 10
      },
      "IMPLEMENTED": {
        "NOT_APPLICABLE": 2,
        "PENDING": 8
      },
      "INTERPRETED": {
        "PASS": 10
      },
      "LINKED": {
        "NOT_APPLICABLE": 2,
        "PENDING": 8
      },
      "PROVED": {
        "NOT_APPLICABLE": 5,
        "PENDING": 5
      },
      "TESTED": {
        "NOT_APPLICABLE": 5,
        "PENDING": 5
      },
      "TYPECHECKED": {
        "PENDING": 10
      }
    },
    "obligations": 10,
    "required_obligations": 10
  },
  "determinism": {
    "compared": [],
    "excluded_nondeterministic_fields": [
      "recorded_at",
      "time",
      "wall_ms",
      "frozen_at",
      "staged candidate module path"
    ],
    "mismatches": []
  },
  "endpoint": {
    "end_to_end_eligible": false,
    "established": null,
    "requested": "test_campaign",
    "statement": "No END_TO_END_VERIFIED claim: Tiers 0 and 1 are ineligible; the endpoint is the recorded test campaign or monitored runtime."
  },
  "generated_by": {
    "verifier": "verislop.closure",
    "verifier_hash": "sha256:055e701ac1e4e4c1350a4bcbda181081f8ad1fe9ce4ce23e40700d25262fd7fc",
    "verislop_version": "0.1.0"
  },
  "hypotheses": {
    "O1": [],
    "O2": [],
    "O3": [],
    "O4": [],
    "O5": []
  },
  "infrastructure_errors": [],
  "mappings": [],
  "obligations": {
    "A1": {
      "blocking": [],
      "end_to_end": "NOT_APPLICABLE: assumption is supplied by caller and discharged at function invocation, by the caller providing data that conforms to the stated schema",
      "implementation_assurance": "no implementation claim (assumption is supplied by caller and discharged at function invocation, by the caller providing data that conforms to the stated schema)",
      "kind": "precondition",
      "outcomes": {
        "END_TO_END_VERIFIED": "NOT_APPLICABLE",
        "FORMALIZED": "FAIL",
        "IMPLEMENTED": "NOT_APPLICABLE",
        "INTERPRETED": "PASS",
        "LINKED": "NOT_APPLICABLE",
        "PROVED": "NOT_APPLICABLE",
        "TESTED": "NOT_APPLICABLE",
        "TYPECHECKED": "PENDING"
      },
      "proof_boundary": "assumption: no proposition proved (an assumption is a hypothesis; it is not proved by the theorems that use it)",
      "required": true,
      "required_milestones": [],
      "revision": 1,
      "role": "assumption",
      "state": "INTERPRETED",
      "weakest_required_bridge": "none"
    },
    "D1": {
      "blocking": [],
      "end_to_end": "NOT_APPLICABLE: declarations carry no end-to-end correctness claim",
      "implementation_assurance": "IMPLEMENTED PENDING, LINKED PENDING, TESTED NOT_APPLICABLE",
      "kind": "entity",
      "outcomes": {
        "END_TO_END_VERIFIED": "NOT_APPLICABLE",
        "FORMALIZED": "FAIL",
        "IMPLEMENTED": "PENDING",
        "INTERPRETED": "PASS",
        "LINKED": "PENDING",
        "PROVED": "NOT_APPLICABLE",
        "TESTED": "NOT_APPLICABLE",
        "TYPECHECKED": "PENDING"
      },
      "proof_boundary": "declaration: no proposition proved (a declaration carries no proposition to prove)",
      "required": true,
      "required_milestones": [],
      "revision": 1,
      "role": "declaration",
      "state": "INTERPRETED",
      "weakest_required_bridge": "Tier 0 (None)"
    },
    "D2": {
      "blocking": [],
      "end_to_end": "NOT_APPLICABLE: declarations carry no end-to-end correctness claim",
      "implementation_assurance": "IMPLEMENTED PENDING, LINKED PENDING, TESTED NOT_APPLICABLE",
      "kind": "entity",
      "outcomes": {
        "END_TO_END_VERIFIED": "NOT_APPLICABLE",
        "FORMALIZED": "FAIL",
        "IMPLEMENTED": "PENDING",
        "INTERPRETED": "PASS",
        "LINKED": "PENDING",
        "PROVED": "NOT_APPLICABLE",
        "TESTED": "NOT_APPLICABLE",
        "TYPECHECKED": "PENDING"
      },
      "proof_boundary": "declaration: no proposition proved (a declaration carries no proposition to prove)",
      "required": true,
      "required_milestones": [],
      "revision": 1,
      "role": "declaration",
      "state": "INTERPRETED",
      "weakest_required_bridge": "Tier 0 (None)"
    },
    "D3": {
      "blocking": [],
      "end_to_end": "NOT_APPLICABLE: declarations carry no end-to-end correctness claim",
      "implementation_assurance": "IMPLEMENTED PENDING, LINKED PENDING, TESTED NOT_APPLICABLE",
      "kind": "entity",
      "outcomes": {
        "END_TO_END_VERIFIED": "NOT_APPLICABLE",
        "FORMALIZED": "FAIL",
        "IMPLEMENTED": "PENDING",
        "INTERPRETED": "PASS",
        "LINKED": "PENDING",
        "PROVED": "NOT_APPLICABLE",
        "TESTED": "NOT_APPLICABLE",
        "TYPECHECKED": "PENDING"
      },
      "proof_boundary": "declaration: no proposition proved (a declaration carries no proposition to prove)",
      "required": true,
      "required_milestones": [],
      "revision": 1,
      "role": "declaration",
      "state": "INTERPRETED",
      "weakest_required_bridge": "Tier 0 (None)"
    },
    "N1": {
      "blocking": [],
      "end_to_end": "NOT_APPLICABLE: an explicit exclusion is retained as metadata and prohibits stronger claims",
      "implementation_assurance": "no implementation claim (an explicit exclusion is retained as metadata and prohibits stronger claims)",
      "kind": "explicit_non_goal",
      "outcomes": {
        "END_TO_END_VERIFIED": "NOT_APPLICABLE",
        "FORMALIZED": "FAIL",
        "IMPLEMENTED": "NOT_APPLICABLE",
        "INTERPRETED": "PASS",
        "LINKED": "NOT_APPLICABLE",
        "PROVED": "NOT_APPLICABLE",
        "TESTED": "NOT_APPLICABLE",
        "TYPECHECKED": "PENDING"
      },
      "proof_boundary": "exclusion: no proposition proved (an explicit exclusion is retained as metadata and prohibits stronger claims)",
      "required": true,
      "required_milestones": [],
      "revision": 1,
      "role": "exclusion",
      "state": "INTERPRETED",
      "weakest_required_bridge": "none"
    },
    "O1": {
      "blocking": [],
      "end_to_end": "PENDING: no frozen claim authorizes evidence for this milestone",
      "implementation_assurance": "IMPLEMENTED PENDING, LINKED PENDING, TESTED PENDING",
      "kind": "postcondition",
      "outcomes": {
        "END_TO_END_VERIFIED": "PENDING",
        "FORMALIZED": "FAIL",
        "IMPLEMENTED": "PENDING",
        "INTERPRETED": "PASS",
        "LINKED": "PENDING",
        "PROVED": "PENDING",
        "TESTED": "PENDING",
        "TYPECHECKED": "PENDING"
      },
      "proof_boundary": "PROVED PENDING: Lean reference-model theorem ? (axioms: none; hypotheses: none); proves the model, not the implementation",
      "required": true,
      "required_milestones": [],
      "revision": 1,
      "role": "guarantee",
      "state": "INTERPRETED",
      "weakest_required_bridge": "Tier 0 (None)"
    },
    "O2": {
      "blocking": [],
      "end_to_end": "PENDING: no frozen claim authorizes evidence for this milestone",
      "implementation_assurance": "IMPLEMENTED PENDING, LINKED PENDING, TESTED PENDING",
      "kind": "postcondition",
      "outcomes": {
        "END_TO_END_VERIFIED": "PENDING",
        "FORMALIZED": "FAIL",
        "IMPLEMENTED": "PENDING",
        "INTERPRETED": "PASS",
        "LINKED": "PENDING",
        "PROVED": "PENDING",
        "TESTED": "PENDING",
        "TYPECHECKED": "PENDING"
      },
      "proof_boundary": "PROVED PENDING: Lean reference-model theorem ? (axioms: none; hypotheses: none); proves the model, not the implementation",
      "required": true,
      "required_milestones": [],
      "revision": 1,
      "role": "guarantee",
      "state": "INTERPRETED",
      "weakest_required_bridge": "Tier 0 (None)"
    },
    "O3": {
      "blocking": [],